{
  "version": 13,
  "projectName": "Boulevard Creative Studio",
  "pageMeta": {
    "language": "en",
    "title": "Boulevard — Creative Design Studio",
    "description": "Independent design studio creating bold identities, digital products and memorable brand experiences."
  },
  "tokens": {
    "colors": {
      "paper": {
        "name": "Paper",
        "value": "#f7f7f4",
        "cssVar": "--color-paper"
      },
      "white": {
        "name": "White",
        "value": "#ffffff",
        "cssVar": "--color-white"
      },
      "ink": {
        "name": "Ink",
        "value": "#181818",
        "cssVar": "--color-ink"
      },
      "muted": {
        "name": "Muted",
        "value": "#666a70",
        "cssVar": "--color-muted"
      },
      "line": {
        "name": "Line",
        "value": "#dadddf",
        "cssVar": "--color-line"
      },
      "soft": {
        "name": "Soft surface",
        "value": "#eef0f2",
        "cssVar": "--color-soft"
      },
      "blue": {
        "name": "Boulevard blue",
        "value": "#2441c5",
        "cssVar": "--color-blue"
      },
      "periwinkle": {
        "name": "Periwinkle",
        "value": "#8296ff",
        "cssVar": "--color-periwinkle"
      },
      "lime": {
        "name": "Acid lime",
        "value": "#d9ff2f",
        "cssVar": "--color-lime"
      },
      "dark": {
        "name": "Footer dark",
        "value": "#1c1c1c",
        "cssVar": "--color-dark"
      }
    },
    "typography": {
      "sans": {
        "name": "Sans",
        "value": "Arial, Helvetica, sans-serif",
        "cssVar": "--typography-sans"
      },
      "mono": {
        "name": "Mono",
        "value": "ui-monospace, SFMono-Regular, monospace",
        "cssVar": "--typography-mono"
      }
    },
    "spacing": {
      "xs": {
        "name": "XS",
        "value": "8px"
      },
      "sm": {
        "name": "Small",
        "value": "14px"
      },
      "md": {
        "name": "Medium",
        "value": "24px"
      },
      "lg": {
        "name": "Large",
        "value": "48px"
      },
      "xl": {
        "name": "XL",
        "value": "96px"
      }
    },
    "radius": {
      "card": {
        "name": "Card",
        "value": "18px"
      },
      "pill": {
        "name": "Pill",
        "value": "999px"
      }
    },
    "shadows": {
      "soft": {
        "name": "Soft",
        "value": "0 18px 50px rgba(20,25,40,.08)"
      }
    }
  },
  "assets": [
    {
      "id": "asset-device",
      "name": "Brand device",
      "type": "image",
      "src": "data:image/svg+xml;charset=utf-8,%3Csvg%20xmlns%3D%22http%3A%2F%2Fwww.w3.org%2F2000%2Fsvg%22%20viewBox%3D%220%200%20320%20320%22%3E%3Cdefs%3E%3ClinearGradient%20id%3D%22g%22%20x1%3D%220%22%20y1%3D%220%22%20x2%3D%221%22%20y2%3D%221%22%3E%3Cstop%20stop-color%3D%22%230d0d0f%22%2F%3E%3Cstop%20offset%3D%221%22%20stop-color%3D%22%23444952%22%2F%3E%3C%2FlinearGradient%3E%3C%2Fdefs%3E%3Crect%20width%3D%22320%22%20height%3D%22320%22%20rx%3D%2222%22%20fill%3D%22url(%23g)%22%2F%3E%3Cg%20stroke%3D%22rgba(255%2C255%2C255%2C.8)%22%20stroke-width%3D%223%22%3E%3Cpath%20d%3D%22M20%2030%20Q80%20160%2020%20290%22%2F%3E%3Cpath%20d%3D%22M36%2030%20Q88%20160%2036%20290%22%2F%3E%3Cpath%20d%3D%22M52%2030%20Q96%20160%2052%20290%22%2F%3E%3Cpath%20d%3D%22M68%2030%20Q104%20160%2068%20290%22%2F%3E%3Cpath%20d%3D%22M84%2030%20Q112%20160%2084%20290%22%2F%3E%3Cpath%20d%3D%22M100%2030%20Q120%20160%20100%20290%22%2F%3E%3Cpath%20d%3D%22M116%2030%20Q128%20160%20116%20290%22%2F%3E%3Cpath%20d%3D%22M132%2030%20Q136%20160%20132%20290%22%2F%3E%3Cpath%20d%3D%22M148%2030%20Q144%20160%20148%20290%22%2F%3E%3Cpath%20d%3D%22M164%2030%20Q152%20160%20164%20290%22%2F%3E%3Cpath%20d%3D%22M180%2030%20Q160%20160%20180%20290%22%2F%3E%3Cpath%20d%3D%22M196%2030%20Q168%20160%20196%20290%22%2F%3E%3Cpath%20d%3D%22M212%2030%20Q176%20160%20212%20290%22%2F%3E%3Cpath%20d%3D%22M228%2030%20Q184%20160%20228%20290%22%2F%3E%3Cpath%20d%3D%22M244%2030%20Q192%20160%20244%20290%22%2F%3E%3Cpath%20d%3D%22M260%2030%20Q200%20160%20260%20290%22%2F%3E%3Cpath%20d%3D%22M276%2030%20Q208%20160%20276%20290%22%2F%3E%3Cpath%20d%3D%22M292%2030%20Q216%20160%20292%20290%22%2F%3E%3C%2Fg%3E%3Ctext%20x%3D%2224%22%20y%3D%22294%22%20fill%3D%22white%22%20font-size%3D%2213%22%20font-family%3D%22Arial%22%20font-weight%3D%22700%22%3EBrand%20device%3C%2Ftext%3E%3C%2Fsvg%3E",
      "alt": "Brand device"
    },
    {
      "id": "asset-bag",
      "name": "Identity bag",
      "type": "image",
      "src": "data:image/svg+xml;charset=utf-8,%3Csvg%20xmlns%3D%22http%3A%2F%2Fwww.w3.org%2F2000%2Fsvg%22%20viewBox%3D%220%200%20320%20320%22%3E%3Cdefs%3E%3ClinearGradient%20id%3D%22g%22%20x1%3D%220%22%20y1%3D%220%22%20x2%3D%221%22%20y2%3D%221%22%3E%3Cstop%20stop-color%3D%22%23f1f3f5%22%2F%3E%3Cstop%20offset%3D%221%22%20stop-color%3D%22%23dce4ea%22%2F%3E%3C%2FlinearGradient%3E%3C%2Fdefs%3E%3Crect%20width%3D%22320%22%20height%3D%22320%22%20rx%3D%2222%22%20fill%3D%22url(%23g)%22%2F%3E%3Cpath%20d%3D%22M105%2092h110l22%20170H83z%22%20fill%3D%22%23181818%22%2F%3E%3Cpath%20d%3D%22M125%20100c0-58%2070-58%2070%200%22%20fill%3D%22none%22%20stroke%3D%22%23181818%22%20stroke-width%3D%2212%22%2F%3E%3Ctext%20x%3D%22160%22%20y%3D%22214%22%20fill%3D%22white%22%20font-size%3D%2272%22%20font-family%3D%22Arial%22%20text-anchor%3D%22middle%22%3E.us%3C%2Ftext%3E%3Ctext%20x%3D%2224%22%20y%3D%22294%22%20fill%3D%22white%22%20font-size%3D%2213%22%20font-family%3D%22Arial%22%20font-weight%3D%22700%22%3EIdentity%20bag%3C%2Ftext%3E%3C%2Fsvg%3E",
      "alt": "Identity bag"
    },
    {
      "id": "asset-chat",
      "name": "Chat Genius",
      "type": "image",
      "src": "data:image/svg+xml;charset=utf-8,%3Csvg%20xmlns%3D%22http%3A%2F%2Fwww.w3.org%2F2000%2Fsvg%22%20viewBox%3D%220%200%20320%20320%22%3E%3Cdefs%3E%3ClinearGradient%20id%3D%22g%22%20x1%3D%220%22%20y1%3D%220%22%20x2%3D%221%22%20y2%3D%221%22%3E%3Cstop%20stop-color%3D%22%23090a0d%22%2F%3E%3Cstop%20offset%3D%221%22%20stop-color%3D%22%232445e4%22%2F%3E%3C%2FlinearGradient%3E%3C%2Fdefs%3E%3Crect%20width%3D%22320%22%20height%3D%22320%22%20rx%3D%2222%22%20fill%3D%22url(%23g)%22%2F%3E%3Cg%20stroke%3D%22rgba(255%2C255%2C255%2C.8)%22%20stroke-width%3D%223%22%3E%3Cpath%20d%3D%22M20%2030%20Q80%20160%2020%20290%22%2F%3E%3Cpath%20d%3D%22M36%2030%20Q88%20160%2036%20290%22%2F%3E%3Cpath%20d%3D%22M52%2030%20Q96%20160%2052%20290%22%2F%3E%3Cpath%20d%3D%22M68%2030%20Q104%20160%2068%20290%22%2F%3E%3Cpath%20d%3D%22M84%2030%20Q112%20160%2084%20290%22%2F%3E%3Cpath%20d%3D%22M100%2030%20Q120%20160%20100%20290%22%2F%3E%3Cpath%20d%3D%22M116%2030%20Q128%20160%20116%20290%22%2F%3E%3Cpath%20d%3D%22M132%2030%20Q136%20160%20132%20290%22%2F%3E%3Cpath%20d%3D%22M148%2030%20Q144%20160%20148%20290%22%2F%3E%3Cpath%20d%3D%22M164%2030%20Q152%20160%20164%20290%22%2F%3E%3Cpath%20d%3D%22M180%2030%20Q160%20160%20180%20290%22%2F%3E%3Cpath%20d%3D%22M196%2030%20Q168%20160%20196%20290%22%2F%3E%3Cpath%20d%3D%22M212%2030%20Q176%20160%20212%20290%22%2F%3E%3Cpath%20d%3D%22M228%2030%20Q184%20160%20228%20290%22%2F%3E%3Cpath%20d%3D%22M244%2030%20Q192%20160%20244%20290%22%2F%3E%3Cpath%20d%3D%22M260%2030%20Q200%20160%20260%20290%22%2F%3E%3Cpath%20d%3D%22M276%2030%20Q208%20160%20276%20290%22%2F%3E%3Cpath%20d%3D%22M292%2030%20Q216%20160%20292%20290%22%2F%3E%3C%2Fg%3E%3Ctext%20x%3D%2224%22%20y%3D%22294%22%20fill%3D%22white%22%20font-size%3D%2213%22%20font-family%3D%22Arial%22%20font-weight%3D%22700%22%3EChat%20Genius%3C%2Ftext%3E%3C%2Fsvg%3E",
      "alt": "Chat Genius"
    },
    {
      "id": "asset-field",
      "name": "Field Type",
      "type": "image",
      "src": "data:image/svg+xml;charset=utf-8,%3Csvg%20xmlns%3D%22http%3A%2F%2Fwww.w3.org%2F2000%2Fsvg%22%20viewBox%3D%220%200%20320%20320%22%3E%3Cdefs%3E%3ClinearGradient%20id%3D%22g%22%20x1%3D%220%22%20y1%3D%220%22%20x2%3D%221%22%20y2%3D%221%22%3E%3Cstop%20stop-color%3D%22%23eef1ff%22%2F%3E%3Cstop%20offset%3D%221%22%20stop-color%3D%22%236275e8%22%2F%3E%3C%2FlinearGradient%3E%3C%2Fdefs%3E%3Crect%20width%3D%22320%22%20height%3D%22320%22%20rx%3D%2222%22%20fill%3D%22url(%23g)%22%2F%3E%3Cg%20stroke%3D%22rgba(255%2C255%2C255%2C.8)%22%20stroke-width%3D%223%22%3E%3Cpath%20d%3D%22M20%2030%20Q80%20160%2020%20290%22%2F%3E%3Cpath%20d%3D%22M36%2030%20Q88%20160%2036%20290%22%2F%3E%3Cpath%20d%3D%22M52%2030%20Q96%20160%2052%20290%22%2F%3E%3Cpath%20d%3D%22M68%2030%20Q104%20160%2068%20290%22%2F%3E%3Cpath%20d%3D%22M84%2030%20Q112%20160%2084%20290%22%2F%3E%3Cpath%20d%3D%22M100%2030%20Q120%20160%20100%20290%22%2F%3E%3Cpath%20d%3D%22M116%2030%20Q128%20160%20116%20290%22%2F%3E%3Cpath%20d%3D%22M132%2030%20Q136%20160%20132%20290%22%2F%3E%3Cpath%20d%3D%22M148%2030%20Q144%20160%20148%20290%22%2F%3E%3Cpath%20d%3D%22M164%2030%20Q152%20160%20164%20290%22%2F%3E%3Cpath%20d%3D%22M180%2030%20Q160%20160%20180%20290%22%2F%3E%3Cpath%20d%3D%22M196%2030%20Q168%20160%20196%20290%22%2F%3E%3Cpath%20d%3D%22M212%2030%20Q176%20160%20212%20290%22%2F%3E%3Cpath%20d%3D%22M228%2030%20Q184%20160%20228%20290%22%2F%3E%3Cpath%20d%3D%22M244%2030%20Q192%20160%20244%20290%22%2F%3E%3Cpath%20d%3D%22M260%2030%20Q200%20160%20260%20290%22%2F%3E%3Cpath%20d%3D%22M276%2030%20Q208%20160%20276%20290%22%2F%3E%3Cpath%20d%3D%22M292%2030%20Q216%20160%20292%20290%22%2F%3E%3C%2Fg%3E%3Ctext%20x%3D%2224%22%20y%3D%22294%22%20fill%3D%22white%22%20font-size%3D%2213%22%20font-family%3D%22Arial%22%20font-weight%3D%22700%22%3EField%20Type%3C%2Ftext%3E%3C%2Fsvg%3E",
      "alt": "Field Type"
    },
    {
      "id": "asset-detail",
      "name": "Identity detail",
      "type": "image",